{
  "actual_tokens": 61468,
  "distractor_directory": "generated-distractors",
  "files": [
    {
      "generated": true,
      "path": "generated-distractors/distractor-0001.md",
      "sha256": "51d40f07d29e3084b339c291d04ebd4bb588dd008627b0de73ffcd48b361b310"
    },
    {
      "generated": true,
      "path": "generated-distractors/distractor-0002.md",
      "sha256": "7da1108c88d396cbee56b32aefbda90bfabd04f2f5fa93ec5940fee62c42edcc"
    },
    {
      "generated": true,
      "path": "generated-distractors/distractor-0003.md",
      "sha256": "94d16a6679479b391939e5c74b7d62f4a169d311c0ee65c072b3a1d88af45ded"
    },
    {
      "generated": true,
      "path": "generated-distractors/distractor-0004.md",
      "sha256": "da27596438c2f4eda23ba682b56b44f5d7b2f133de7cd86ec32a04bbc33dd51f"
    },
    {
      "generated": true,
      "path": "generated-distractors/distractor-0005.md",
      "sha256": "60c5095f6f1f35e449062ba27cec296aee92ee8661b31fd62100c7294a89a2cf"
    },
    {
      "generated": true,
      "path": "generated-distractors/distractor-0006.md",
      "sha256": "6742aedcb4bf376947412319bb79b076656030805a7b722b8c57e1d8607de063"
    },
    {
      "generated": true,
      "path": "generated-distractors/distractor-0007.md",
      "sha256": "14f8953d70ec0074a53c9c601c65249fac236982cbdbc77fdecd8b6407f02616"
    },
    {
      "generated": true,
      "path": "generated-distractors/distractor-0008.md",
      "sha256": "4c8cf3f2a7c155808b0639741c2e5d50fed7cdf209995a202370620aeaa4ef45"
    },
    {
      "generated": true,
      "path": "generated-distractors/distractor-0009.md",
      "sha256": "d066b4777753edbd75e046a8239fff817b0d2a743fdcf52d2f3886cb02dbb4b6"
    },
    {
      "generated": true,
      "path": "generated-distractors/distractor-0010.md",
      "sha256": "e7682ba793bfc2891c2f40c03d9ca93f7cb16d4d467ca103f69b46f9c62e7ea6"
    },
    {
      "generated": true,
      "path": "generated-distractors/distractor-0011.md",
      "sha256": "3b1e5dd0381d64abe4f28486ecf4c91a23c6ae9f11cf1c31ecdb5e9c07505843"
    },
    {
      "generated": true,
      "path": "generated-distractors/distractor-0012.md",
      "sha256": "26038c44e90317e410b8e85d8dd7f24d4a1e48bda59475a3606788cdc61b494d"
    },
    {
      "generated": true,
      "path": "generated-distractors/distractor-0013.md",
      "sha256": "990fcf9ace5ab2efbc4275cb1d64cc15f112835c37e89153749ebf7f7afe3d53"
    },
    {
      "generated": true,
      "path": "generated-distractors/distractor-0014.md",
      "sha256": "8386a99996a84dd7dcdde66fe9dba0377c5962ec8e5eeb6d4ea1025cbec28796"
    },
    {
      "generated": true,
      "path": "generated-distractors/distractor-0015.md",
      "sha256": "6fdfc5a51fa08d0508858264541394904391eb2d81993e642a6e547bbe33baba"
    },
    {
      "generated": true,
      "path": "generated-distractors/distractor-0016.md",
      "sha256": "a53109544f3fe9fa9338c7ce495bfeef4de5dfd824511a9d22e9c45a923b7544"
    },
    {
      "generated": true,
      "path": "generated-distractors/distractor-0017.md",
      "sha256": "348c2467b8153c2db91d9efb41dbdd6c115dcfc9ffc40dd0c832f45235d9e1d4"
    },
    {
      "generated": true,
      "path": "generated-distractors/distractor-0018.md",
      "sha256": "2280be71f70b4467352049ac1e6cde50cf122844b0d355b9fe504f34803dceca"
    },
    {
      "generated": true,
      "path": "generated-distractors/distractor-0019.md",
      "sha256": "969a9305eb4b93cebdaeac6708eee918d958ca2dbe84bb2ef0b5fde51b91b715"
    },
    {
      "generated": true,
      "path": "generated-distractors/distractor-0020.md",
      "sha256": "b2cdf04a70b198217227b99e6468937cbdb2b2db9b3c0309f757bc5185ae2d97"
    },
    {
      "generated": true,
      "path": "generated-distractors/distractor-0021.md",
      "sha256": "e3d51012040f92e4ebc956cc0a74caa39fb1fbe41e531052f27a88c249f1ea65"
    },
    {
      "generated": true,
      "path": "generated-distractors/distractor-0022.md",
      "sha256": "48ae02cda2b8b767d9ba01ac2596fe2749b9fba1a191d61859ffaadb73ceab0c"
    },
    {
      "generated": true,
      "path": "generated-distractors/distractor-0023.md",
      "sha256": "8133e4871b6b1f8677dc72ce10560a6175e608156cffc7ce468816abb95b164f"
    },
    {
      "generated": true,
      "path": "generated-distractors/distractor-0024.md",
      "sha256": "939ad3704108b3041c8463dd742c57b43e826e80c66c741b1f1f079999f75480"
    },
    {
      "generated": true,
      "path": "generated-distractors/distractor-0025.md",
      "sha256": "5b6238b250375ee1349037d9f75a9b1a693ef9bd3c1ef97842b395c79fd7c41c"
    },
    {
      "generated": true,
      "path": "generated-distractors/distractor-0026.md",
      "sha256": "6be2032e2ac5c125acb9272841a12ac13ee34837cf7bf23f1841668d5778a6ae"
    },
    {
      "generated": true,
      "path": "generated-distractors/distractor-0027.md",
      "sha256": "bf5882c4a74d4e2a9c14d1ad208ef1757c3db9fc286e5164c289c373c8dbfe6d"
    },
    {
      "generated": true,
      "path": "generated-distractors/distractor-0028.md",
      "sha256": "b560d9f72c0cb0584ace812eeadb0de96996106b3f9f502f587e6931eef02e2c"
    },
    {
      "generated": true,
      "path": "generated-distractors/distractor-0029.md",
      "sha256": "47535e79746f7e986c031d44f7700c383a88cb6133aacded5c9e091689d37d52"
    },
    {
      "generated": true,
      "path": "generated-distractors/distractor-0030.md",
      "sha256": "beafc10aaa601f6d1dbc0b666c6fe6f57fa9f6518f3521e34ca2b7e9d3f8ea79"
    },
    {
      "generated": true,
      "path": "generated-distractors/distractor-0031.md",
      "sha256": "1176ca578de6ccb73244f8e609bfb606303239cea1de8e6ad7c0fc9d9bb8ebd2"
    },
    {
      "generated": false,
      "path": "reference/api-contracts.md",
      "sha256": "fbe2bb834315cae6744fe5e6d790e996290a02b16c2388dd1ca8a1a8df7b979e"
    },
    {
      "generated": false,
      "path": "reference/architecture-notes.md",
      "sha256": "01dfe0741f507a49a2c10cbae9c620f5fa3c716dfb647215e1202d9ac7773b4b"
    },
    {
      "generated": false,
      "path": "reference/domain-glossary.md",
      "sha256": "78e7dd35a696f9791b1948e0726f7036306be2b549f676ef92509aa680ee79ac"
    },
    {
      "generated": false,
      "path": "reference/legacy-decisions.md",
      "sha256": "190dd75cf21b93c9a79a382d96be47fb3a8cfad6f9aee1d2108803cca6772345"
    },
    {
      "generated": false,
      "path": "reference/test-fixture-catalog.md",
      "sha256": "ea0e7740fa67619341d3fd63c0fe7645dc4dc31503bae693005bc7a3e69a1f36"
    },
    {
      "generated": false,
      "path": "src/billing.py",
      "sha256": "43e307244303f568452745a920b86bf9228642c9a2532da1bd2af2bc9b40fd29"
    }
  ],
  "relevant_files": [
    "src/billing.py"
  ],
  "schema_version": "1.0",
  "seed": 20260915,
  "source": "tasks/context/CTX-01/workspace",
  "target_tokens": 60000,
  "token_count_method": "fallback:regex",
  "tokenizer": null,
  "variant": "ctx-60k"
}
